{
  "@id": "datasetid",
  "@vers": "20191108",
  "@prev": "20191101",
  "datasetName": "Name of Dataset",
  "datenBeschreibung": "A description",
  "dsgvoAttribute": {
    "attrName1": {
      "dsgvoPersonenbezug": "personenbeziehbar",
      "dsgvoAufgabe": "pseudonymisieren",
      "dsgvoVerwendungszweck": "",
      "dsgvoAnmerkung": "Eine weitere Anmerkung."
    },
    "attrName2": {
      "dsgvoPersonenbezug": "personenbezogen",
      "dsgvoAufgabe": "annonymisieren",
      "dsgvoVerwendungszweck": "",
      "dsgvoAnmerkung": "Eine weitere Anmerkung."
    },
    "attrName3": {
      "dsgvoPersonenbezug": "none",
      "dsgvoAufgabe": "none",
      "dsgvoVerwendungszweck": "Any purpose",
      "dsgvoAnmerkung": ""
    }
  },
  "zeitpunkt": 45678765435678
}
